{
  "shot_id": "cli-shot",
  "pillar_I": {
    "target": "6",
    "pocket": "top-right",
    "destination": {
      "descriptor": "center-table, for the 7",
      "coordinates_m": [
        0.55,
        2.0
      ]
    },
    "intention_pure": true
  },
  "pillar_II": {
    "line_of_aim": {
      "description": "aim through the cue center toward the ghost ball at (0.61, 1.25)",
      "vector": [
        0.3,
        0.5,
        0.6082303522585822,
        1.2495073425159617
      ]
    },
    "contact_point": {
      "description": "thick hit (~0.92), 5\u00b0 cut",
      "cut_angle_deg": 4.762221129798464,
      "ball_fraction": 0.9169792279945725
    },
    "escape_route": {
      "description": "cue tangents off the stun line, no rails crossed",
      "path_points_m": [
        [
          0.6082303522585822,
          1.2495073425159617
        ],
        [
          0.6875479743926998,
          1.9407035728296118
        ]
      ]
    },
    "rails_involved": [
      "none"
    ],
    "speed_window": {
      "label": "medium",
      "m_per_s": 1.9148924554374465
    }
  },
  "pillar_III": {
    "english": {
      "sauce_term": "healthy pour of left",
      "tips_offset": -1.0
    },
    "stroke": {
      "type": "draw",
      "sauce_term": "full draw",
      "tips_offset_vertical": -1.0
    },
    "force": "measured dose",
    "acceleration": "controlled",
    "recipe_rationale": "full draw and healthy pour of left carries the cue through the 5\u00b0 cut"
  },
  "pillar_IV": {
    "owned_by_user": true,
    "note": "The stance, the breath, the stillness, the strike."
  },
  "table_state": {
    "cue_ball": {
      "x_m": 0.3,
      "y_m": 0.5
    },
    "balls": [
      {
        "id": "cue",
        "x_m": 0.3,
        "y_m": 0.5,
        "is_target": false
      },
      {
        "id": "6",
        "x_m": 0.635,
        "y_m": 1.3,
        "is_target": true
      }
    ],
    "table_size_m": [
      2.54,
      1.27
    ]
  }
}
